<?xml version="1.0" encoding="UTF-8" standalone="no"?>
<emgGenerator xmlns:xsi="http://www.w3.org/2001/XMLSchema-instance" xsi:noNamespaceSchemaLocation="emgGenerator.xsd">
<experimental>
	<emg id="emgId1"/>
	<emg id="emgId2"/>
	<emg id="emgId3"/>
	<emg id="emgId4"/>
	<emg id="emgId5"/>
	<emg id="emgId6"/>
	<emg id="emgId7"/>
</experimental>

<mapping>
	<emg id="emgId8"
		 operation="sum">
		 emgId1
		 emgId2
	</emg>

	<emg id="emgId9"
		 operation="mean">
		 emgId1
		 emgId2
	</emg>

	<emg id="emgId10"
		 operation="assign">
		 emgId2
	</emg>

	<emg id="emgId11"
		 operation="nil"/>
 </mapping>
 
<output>
	emgId1 emgId2 emgId3 emgId4 emgId5 emgId6 emgId7 emgId8 emgId9 emgId10 emgId11
</output>
</emgGenerator>
